{
  "product_name": "Acme Analytics Dashboard",
  "overview": "A web-based dashboard for visualizing and analyzing business metrics in real time.",
  "objectives": [
    "Enable users to track KPIs",
    "Provide customizable reports",
    "Support real-time data updates"
  ],
  "features": [
    {
      "name": "User Authentication",
      "description": "Allow users to securely log in and manage their accounts.",
      "priority": "High",
      "acceptance_criteria": [
        "Users can register and log in",
        "Passwords are securely stored"
      ]
    },
    {
      "name": "Customizable Dashboards",
      "description": "Users can create and customize dashboards with widgets.",
      "priority": "High",
      "acceptance_criteria": [
        "Users can add, remove, and rearrange widgets",
        "Dashboards are saved per user"
      ]
    },
    {
      "name": "Data Export",
      "description": "Export dashboard data to CSV or PDF.",
      "priority": "Medium",
      "acceptance_criteria": [
        "Users can export data in multiple formats"
      ]
    }
  ],
  "stakeholders": [
    "Product Manager",
    "Lead Engineer",
    "UX Designer"
  ],
  "timeline": "Q3 2025: MVP launch; Q4 2025: Feature expansion",
  "metrics": [
    "User adoption rate",
    "Average session duration",
    "Number of dashboards created"
  ]
}
